Title,Company,Salary,Location,ExpireDate,Link,ProjectDescription
"Manager, Omnichannel Analytics",AbbVie,91417.74,"Florham Park, Morris County",No information,https://www.adzuna.com/details/4896800297?utm_medium=api&utm_source=cdc424ab,"Job Description AbbVie’s US Commercial organization is looking for a strong analytical candidate to join a high-performing team supporting Digital Marketing. In this role, you’ll be responsible for delivering analysis, insights, and recommendations to Marketing leaders in support of brand strategy. You’ll use your knowledge of digital and non-digital channels and relevant data to identify trends in performance and build a narrative around appropriate strategic and tactical adjustments to drive …"
Senior Application Integration Consultant (ONSITE),Serigor Inc.,99977.18,"Washington, Washington, D.C.",No information,https://www.adzuna.com/details/4688234676?utm_medium=api&utm_source=cdc424ab,"Job Title: Senior Application Integration Consultant (ONSITE) Location: Washington, DC Duration: 12 Months Job Description: The client seeks a senior application integration consultant to assist in migrating its enterprise integration platform from on-premises Oracle SOA suite to Azure Cloud solution. Job Responsibilities: Expertise and Strong hands-on experience in technologies related to application integration. Implementation of projects with integration platforms like Oracle SOA, Microsoft …"
Full-Stack Engineer (with ML/AI Exposure),Unreal Gigs,130000,"Boston, Suffolk County",No information,https://www.adzuna.com/details/4646601982?utm_medium=api&utm_source=cdc424ab,"About Us: We are a dynamic startup committed to pushing the boundaries of technology and innovation. Our team is growing, and we are looking for a Full-Stack Engineer who is passionate about building scalable systems and has a keen interest in machine learning and artificial intelligence. Requirements Key Responsibilities: Develop and maintain scalable, robust, and high-performance web applications and services. Collaborate with cross-functional teams to define, design, and ship new features an…"
"Software Configuration Management Specialist, Journeyman",Semper Valens Solutions,155301.27,"Belcamp, Harford County",No information,https://www.adzuna.com/details/4851659958?utm_medium=api&utm_source=cdc424ab,"Software Configuration Management Specialist, Journeyman Full time, APG, MD Top Secret/SCI Clearance Job Description: Responsibilities The SWCMS will provide functional and empirical analysis related to software CM plans and procedures. The SWCMS's full time duty location will be onsite at APG. Must have experience in the following: Writing Configuration Management (CM) Plans and audit software change procedures, software development, software testing, and software documentation to verify compl…"
Cryptologic Computer Scientist,Independent Software,79836.41,"Columbia, Howard County",No information,https://www.adzuna.com/details/4417476475?utm_medium=api&utm_source=cdc424ab,"What you will be doing As a Cryptologic Computer Scientist, you will design, develop, deliver, and operate solutions to hard cryptologic computer science problems within a scientific framework. The solutions may arise in the forms of forensics and attack attribution, protection of critical networks, active systems warnings and indicator, active penetration into target systems, knowledge discovery of passive and active systems, or other cryptologic computer science mission support. Key Requireme…"
Lead Tools Support Engineer,JM Chandler Dream Builders,115200,"Tampa, Hillsborough County",No information,https://www.adzuna.com/details/4891527697?utm_medium=api&utm_source=cdc424ab,"If you post this job on a job board, please do not use company name or salary. Experience level: Mid-senior Experience required: 8 Years Education level: Bachelors degree Job function: Information Technology Industry: Financial Services Pay rate : View hourly payrate Total position: 1 Relocation assistance: No Visa sponsorship eligibility: No This role is 6 Months Contract to Hire The first round of interviews will be onsite at DTCC office (Tampa, FL or Coppell, TX) Job Summary In this position…"
Cyber Security Director,Evolver Federal,157452.92,"Suitland, Prince George's County",No information,https://www.adzuna.com/details/4900643066?utm_medium=api&utm_source=cdc424ab,"Evolver Federal is seeking a Cyber Security Director to join our team in support of a US Federal Government customer in Camp Springs, MD. Responsibilities include management oversight of teams providing a broad range of cybersecurity support services. The Cyber Security Director will have prior experience managing projects within a security team using Agile methodologies and demonstrated success in driving process improvement. This is a ""hands on"" role in the client environment, requiring overs…"